"Product";"ASIN";"SKU";"Units";"Refunds";"Sales";"Promo";"Ads";"Sponsored products (PPC)";"Sponsored Display";"Sponsored brands (HSA)";"Sponsored Brands Video";"Google ads";"Facebook ads";"% Refunds";"Sellable Quota";"Refund сost";"Amazon fees";"Cost of Goods";"Shipping";"Gross profit";"Net profit";"Estimated payout";"Expenses";"Margin";"ROI";"BSR";"Real ACOS";"Sessions";"Unit Session Percentage"
"NewEleven Retirement Gifts For Men 2025 - Coworker Leaving, Goodbye Gift, Farewell Gifts For Coworkers, Friends, Dad, Grandpa - Retirement Gift For Men From Friend, Family, Colleague - Whiskey Glass COG: 1,96 / Price: 22,98";"B0F18CMJ3L";"CU-4EWE-9UH1";"60";"2";"1 378,8";"-8,05";"-174,3";"-169,88";"";"-4,42";"";"";"";"3,33";"100";"-36,93";"-498,66";"-117,6";"";"543,26";"543,26";"658,9";"";"39,40";"461,96";"11 452";"12,64";"";""
"NewEleven 50th Birthday Gifts For Men Women - 1975 50th Birthday Decorations For Him Her - Present For Men Women Turning 50 Year Old Gifts For Mom, Dad, Wife, Husband - 20 Oz Tumbler COG: 3,29 / Price: 19,98";"B0DH7YGD9Q";"EC-NYJH-0YZA";"50";"2";"999";"";"-181,86";"-177,22";"";"-4,64";"";"";"";"4,00";"100";"-30,52";"-372,26";"-164,5";"";"249,86";"249,86";"411,07";"";"25,01";"151,89";"3 679";"18,20";"";""
"NewEleven Retirement Gift For Woman, Men 2025 - Goodbye Present, Going Away Gift, Farewell Gifts For Coworkers - Retirement Gifts For Men, Women From Colleague, Friend, Family - 20 Oz Tumbler COG: 3,5 / Price: 22,98";"B0F18PVLJ1";"WD-3UXP-TSPV";"50";"2";"1 149";"-11,49";"-266,73";"-266,73";"";"";"";"";"";"4,00";"-";"-39,88";"-415,09";"-175";"";"240,81";"240,81";"415,81";"";"20,96";"137,61";"18 232";"23,21";"";""
"NewEleven 40th Birthday Gifts For Women, Her - 1985 40th Birthday Decorations For Women - 40 Year Old Gifts For Her, Mom, Wife, Sister, Friends - 16 Oz Coffee Glass COG: 1,99 / Price: 16,98";"B0DGGDX9P5";"EI-6RN9-0Z0A";"30";"1";"509,4";"";"-60,34";"-60,34";"";"";"";"";"";"3,33";"-";"-14,73";"-230,76";"-59,7";"";"143,87";"143,87";"203,57";"";"28,24";"240,99";"11 488";"11,85";"";""
"NewEleven Fathers Day Gift For Dad - Birthday Gifts For Dad From Daughter, Son, Kids - Husband Gift - Birthday Present Ideas For Father, New Papa, Bonus Father From Daughter, Son - 20 Oz Tumbler COG: 3,56 / Price: 19,98";"B0CG8N67SJ";"FQ-Q5JW-E8TK";"26";"";"519,48";"-12";"-109,46";"-109,46";"";"";"";"";"";"";"-";"";"-177,09";"-96,12";"";"124,81";"124,81";"220,93";"";"24,03";"129,85";"7 641";"21,07";"";""
"NewEleven Gifts For Women - Wedding Anniversary Card For Wife, Husband, Couple - Romanic Love Gifts For Boyfriend From Girlfriend, Her - Greeting Card COG: 0,42 / Price: 6,99";"B0FC5SSDXK";"D0-B6A7-C5GP";"22";"";"153,78";"";"-15,79";"-15,79";"";"";"";"";"";"";"-";"";"-75,83";"-9,24";"";"52,92";"52,92";"62,16";"";"34,41";"572,73";"20 331";"10,27";"";""
"NewEleven Sister Birthday Gifts - Gift For Sister, Soul Sis, Sisters In Law - Sisters Gifts From Sister, Brother, Friend, Family - Decorative Glass Scripture Jar With 92 Bible Verse COG: 2,59 / Price: 18,98";"B0F13S4HSG";"M7-LMCU-PTYK";"21";"";"398,58";"-0,95";"-71,72";"-71,72";"";"";"";"";"";"";"-";"";"-152,83";"-54,39";"";"118,69";"118,69";"173,08";"";"29,78";"218,22";"17 544";"17,99";"";""
"NewEleven Retirement Gifts, Farewell Gift, Goodbye Present for Coworkers, New Beginnings Gifts for Women Men, Christmas Gift for Coworkers Friends Work Bestie Boss Leader - 8 Oz Candle COG: 4,99 / Price: 15,98";"B0D7HMXCSP";"UB-TA3P-4YBQ";"18";"";"287,64";"";"";"";"";"";"";"";"";"";"-";"";"-137,15";"-89,82";"";"60,67";"60,67";"150,49";"";"21,09";"67,55";"87 308";"";"";""
"NewEleven Women - Friend Gifts Ornaments 2025 - Friendship Gifts for Friends, Birthday Gift for Women, Besties, Soul Sisters - Ceramic Christmas Ornaments COG: 0,91 / Price: 4,99";"B0DK16MCXG";"JC-JJYR-OWD3";"18";"";"89,82";"-4,19";"";"";"";"";"";"";"";"";"-";"";"-48,23";"-20,93";"";"16,47";"16,47";"37,4";"";"18,34";"78,69";"295 073";"";"";""
"NewEleven Retirement Gift For Woman 2025 - Cool Retirement Gifts - Coworker Leaving Gifts, Farewell Presents, Retired Decorations, Farewell Goodbye Gift For Coworkers, Friends - 16 Oz Wine Glass COG: 4,48 / Price: 22,98";"B0DH88L44J";"3E-J0TV-6W9S";"17";"1";"390,66";"";"-116,77";"-116,77";"";"";"";"";"";"5,88";"100";"-6,5";"-176,79";"-76,16";"";"14,44";"14,44";"77,16";"";"3,70";"18,96";"21 022";"29,89";"";""
"NewEleven Gifts For Mom, New Mother - Gifts For a Mom of Boys, Pregnant Mother, Expecting Momomy, Mama, Moms To Be, Mommy To Be - 16 Oz Coffee Glass COG: 2,8 / Price: 15,98";"B0CRVTN11L";"Y1-7KOS-V5KR";"16";"";"255,68";"";"-54,67";"-54,67";"";"";"";"";"";"";"-";"";"-121,86";"-44,8";"";"34,35";"34,35";"79,15";"";"13,43";"76,67";"11 496";"21,38";"";""
"NewEleven Gifts For Mom - Birthday Card For Mom From Daughter, Son, Kids, Husband - Wife Gift - Unique Present Ideas For Mother, Mother In Law, Wife, New Mama - Greeting Card COG: 0,46 / Price: 9,99";"B0F2TDMHFC";"LT-01MF-LZ2N";"15";"";"149,85";"";"-35,4";"-35,4";"";"";"";"";"";"";"-";"";"-59,1";"-6,9";"";"48,45";"48,45";"55,35";"";"32,33";"702,17";"12 039";"23,62";"";""
"NewEleven Gifts For Aunt - Aunt Gifts From Niece, Nephew - Birthday Gift For Auntie, New Aunts, Auntie, To Be Aunts - 16 Oz Coffee Glass COG: 2,58 / Price: 15,98";"B0CQJZP6TK";"FJ-K5JP-AWYT";"14";"";"223,72";"-4,96";"-47,16";"-47,16";"";"";"";"";"";"";"-";"";"-99,72";"-36,12";"";"35,76";"35,76";"71,88";"";"15,98";"99,00";"22 247";"21,08";"";""
"NewEleven 50th Birthday Gifts For Women, Her - 1975 50th Birthday Decorations - Gift For Women Turning 50-50 Year Old Gifts For Her, Mom, Wife, Friends - 12 Oz Wine Tumbler COG: 3,39 / Price: 16,98";"B089QFYLFB";"XH-ELQT-PEJ2";"13";"";"220,74";"";"-50,96";"-50,96";"";"";"";"";"";"";"-";"";"-90,6";"-44,07";"";"35,11";"35,11";"79,18";"";"15,91";"79,67";"11 758";"23,09";"";""
"NewEleven 60th Birthday Gifts For Women - 1965 Birthday Decorations For Women - Happy 60th Celebration Gifts - Gift for turning 60 For Mom, Wife, Aunt - 12 Oz Wine Tumbler COG: 3,31 / Price: 19,98";"B08R8PXYL6";"ZG-6MPB-F5JV";"12";"1";"239,76";"";"-35,44";"-35,44";"";"";"";"";"";"8,33";"-";"-17,34";"-89,35";"-39,72";"";"57,91";"57,91";"97,63";"";"24,15";"145,80";"11 758";"14,78";"";""
"NewEleven 50th Birthday Gifts For Women - 1975 50th Birthday Decorations For Women - Gifts For Her Turning 50 Year Old - 20 Oz Tumbler COG: 3,31 / Price: 21,98";"B0DH7X6R1J";"YJ-F5N3-DGJ5";"12";"1";"263,76";"";"-46,51";"-46,51";"";"";"";"";"";"8,33";"-";"-19,08";"-93,1";"-39,72";"";"65,35";"65,35";"105,07";"";"24,78";"164,53";"3 679";"17,63";"";""
"NewEleven 40th Birthday Gifts For Men Women - 1985 40th Birthday Decorations For Men Women - 40 Year Old Birthday Gifts For Dad, Mom, Friends Turning 40-20 Oz Tumbler COG: 4,21 / Price: 22,98";"B08R8R2LQF";"JC-JMFX-W7IY";"11";"1";"252,78";"";"-28,81";"-28,81";"";"";"";"";"";"9,09";"100";"-15,73";"-87,75";"-46,31";"";"74,18";"74,18";"116,28";"";"29,35";"160,18";"20 618";"11,40";"";""
"NewEleven Retirement Gifts For Woman 2025 - Funny Retirement Gifts For Coworker Leaving - Farewell, Leaving, Goodbye Gift For Coworkers, Friends - 12 Oz Tumbler COG: 4,14 / Price: 22,98";"B08ZRWW1W4";"A6-H1II-ZKFG";"9";"1";"206,82";"";"-75,55";"-75,55";"";"";"";"";"";"11,11";"-";"-19,94";"-71,7";"-37,26";"";"2,37";"2,37";"39,63";"";"1,15";"6,36";"22 480";"36,53";"";""
"NewEleven Gifts For Aunt From Niece, Nephew - Cool Gifts For Auntie, Sister - Aunty Birthday Gift - Announcement, Promoted To Aunt - 16 Oz Coffee Glass COG: 2,23 / Price: 15,98";"B0BYCT1SRJ";"LH-BSSY-KKX9";"9";"";"143,82";"";"-50,38";"-50,38";"";"";"";"";"";"";"-";"";"-68,55";"-20,07";"";"4,82";"4,82";"24,89";"";"3,35";"24,02";"30 717";"35,03";"";""
"NewEleven 60th Birthday Gifts For Women - 1965 60th Birthday Decorations For Woman - Turning 60-60 Year Old Gifts For Women, Mom, Wife - 20 Oz Tumbler COG: 3,26 / Price: 21,98";"B0DM63J16N";"CB-D2S7-7LAE";"9";"1";"197,82";"";"-61,27";"-61,27";"";"";"";"";"";"11,11";"-";"-19,08";"-69,78";"-29,34";"";"18,35";"18,35";"47,69";"";"9,28";"62,54";"3 679";"30,97";"";""
"NewEleven Funny Retirement Gifts For Men, Women - Going Away Gift, Coworker Leaving Gifts For Women, Farewell Gift For Coworkers, Boss, Colleague - Greeting Card COG: 0,39 / Price: 7,99";"B0FC69XTZ9";"B4-IRKZ-AKKE";"9";"";"71,91";"";"-24,14";"-24,14";"";"";"";"";"";"";"-";"";"-32,46";"-3,51";"";"11,80";"11,80";"15,31";"";"16,41";"336,18";"8 153";"33,57";"";""
"NewEleven House Warming Gifts, New Home Ornament 2025, Dream Home Gift Ideas Decor - Welcome Home Gifts, Housewarming Gift New Home, Best Housewarming Presents 2025 - Glass Ornament COG: 2,33 / Price: 9,99";"B0DPM5JXP7";"BK-7AQP-YXO7";"8";"";"79,92";"";"-11,66";"-11,66";"";"";"";"";"";"";"-";"";"-36,32";"-18,64";"";"13,30";"13,30";"31,94";"";"16,64";"71,35";"97 459";"14,59";"";""
"NewEleven Retirement Gift For Woman - Retirement Card For Women, Men, Boss - Funny Retirements Gifts For Men, Farewell Gifts For Coworkers From Work Bestie, Colleague - Greeting Card COG: 0,39 / Price: 5,99";"B0FC69R4PK";"A9-HSHI-ATQO";"8";"";"47,92";"";"-20,37";"-20,37";"";"";"";"";"";"";"-";"";"-26,29";"-3,12";"";"-1,86";"-1,86";"1,26";"";"-3,88";"-59,62";"8 153";"42,51";"";""
"NewEleven Fathers Day Gift For Dad - Birthday Gifts For Dad From Kids - Husband Gift - Birthday Present Ideas For Father, Husband, New Papa, Bonus Father From Daughter, Son - 20 Oz Tumbler COG: 3,44 / Price: 19,98";"B0CM5RJ8VD";"1J-71GS-RJFC";"7";"";"139,86";"";"";"";"";"";"";"";"";"";"-";"";"-52,1";"-24,08";"";"63,68";"63,68";"87,76";"";"45,53";"264,45";"7 641";"";"";""
"NewEleven Gifts For Husband - Husband Birthday Gift, Christian Gift For Him, Husbands - Anniversary Present For Him Hubby From Wife, Her - Decorative Glass Scripture Jar With 92 Bible Verse COG: 0 / Price: 17,98";"B0FC61VF9P";"5Y-ELMB-DGUB";"7";"";"125,86";"-4,5";"-77,19";"-77,19";"";"";"";"";"";"";"-";"";"-47,34";"";"";"-3,17";"-3,17";"-3,17";"";"-2,52";"";"17 542";"61,33";"";""
"NewEleven Coworker Leaving Gifts - Farewell Gifts, Going Away Gift For Coworker - New Job, Goodbye, Good Luck Gift For Coworkers, Colleagues, Boss, Men, Women, Friends - 20 Oz Tumbler COG: 4,63 / Price: 19,98";"B092HNBJT6";"W7-BHYY-1NZC";"6";"";"119,88";"";"-33,46";"-33,46";"";"";"";"";"";"";"-";"";"-44,68";"-27,78";"";"13,96";"13,96";"41,74";"";"11,64";"50,25";"34 361";"27,91";"";""
"NewEleven Gifts For Mom - Birthday Gifts For Mom From Kids – Unique Birthday Present Ideas For Mother, New Mom, Mom To Be, Wife From Daughter, Son, Husband - 16 Oz Coffee Glass COG: 2,25 / Price: 16,98";"B0C9BZRC4K";"YM-PHWT-7K9Y";"6";"1";"101,88";"";"-22,95";"-22,95";"";"";"";"";"";"16,67";"-";"-14,73";"-46,71";"-13,5";"";"3,99";"3,99";"17,49";"";"3,92";"29,56";"35 423";"22,53";"";""
"NewEleven Gifts For Him - Fishing Gifts For Men, Dad, Fisherman, Father - Practical Gift, Dad Birthday Present, Men, Husband - 20 Oz Tumbler COG: 3,66 / Price: 17,98";"B0CY4MC1GJ";"YJ-23CQ-KDB5";"6";"";"107,88";"";"-32,51";"-32,51";"";"";"";"";"";"";"-";"";"-45,22";"-21,96";"";"8,19";"8,19";"30,15";"";"7,59";"37,30";"19 531";"30,14";"";""
"NewEleven 60th Birthday Gifts For Men Women - 1965 60th Birthday Decorations For Him Her - Turning 60 Year Old Gifts For Man, Woman, Mom, Dad, Wife, Husband - 20 Oz Tumbler COG: 3,31 / Price: 19,98";"B0DH87FYNN";"UM-NFPU-HUFM";"6";"";"119,88";"";"-35,39";"-35,39";"";"";"";"";"";"";"-";"";"-44,67";"-19,86";"";"19,96";"19,96";"39,82";"";"16,65";"100,50";"3 679";"29,52";"";""
"NewEleven 40th Birthday Gifts for Men Women - 1985 40 Year Old Gifts for Men, Women, Dad, Mom, Husband, Wife - Retro Trucker Hat COG: 1,89 / Price: 16,98";"B0DHC932W2";"HO-F3TN-5J1L";"6";"";"101,88";"";"-25,25";"-25,25";"";"";"";"";"";"";"-";"";"-50,77";"-11,34";"";"14,52";"14,52";"25,86";"";"14,25";"128,04";"145 943";"24,78";"";""
"NewEleven 70th Birthday Gifts For Men Women - 1955 70th Birthday Decorations - Gifts For Men Women Turning 70-70 Year Old Gifts For Man, Woman - 20 Oz Tumbler COG: 3,32 / Price: 19,98";"B0DHCGTL3R";"DF-AWOB-F9BG";"6";"";"119,88";"";"-16,32";"-16,32";"";"";"";"";"";"";"-";"";"-44,67";"-19,92";"";"38,97";"38,97";"58,89";"";"32,51";"195,63";"3 679";"13,61";"";""
"NewEleven Engagement Gifts for Couples 2025 - Gift for Newly Engaged Couples, Happy Engagement Gifts for Her, Women, Friends, Bride to Be Gift, Glass Ornament COG: 1,8 / Price: 9,99";"B0DRT3MK34";"87-ARXM-YV1I";"6";"";"59,94";"";"-17,12";"-17,12";"";"";"";"";"";"";"-";"";"-25,27";"-10,8";"";"6,75";"6,75";"17,55";"";"11,26";"62,50";"97 459";"28,56";"";""
"NewEleven Gift For Teachers - Teacher Appreciation Gifts For Women, New Teachers - Teacher Gifts For Women From Student, Friends, Family And Coworker - 20 Oz Tumbler COG: 3,42 / Price: 12,98";"B0DYDZFRZD";"4E-EG59-NN41";"6";"";"77,88";"-1,3";"-20,33";"-20,33";"";"";"";"";"";"";"-";"";"-37,49";"-20,52";"";"-1,76";"-1,76";"18,76";"";"-2,26";"-8,58";"76 040";"26,10";"";""
"NewEleven Gifts For Grandma - Christian Gift, Nana Gift, Grandma Birthday Gifts From Granddaughter, Grandson, Kids - Decorative Glass Inspirational Scripture Jar with 92 Bible Verse COG: 0 / Price: 17,98";"B0FBQZZK71";"RW-PY02-EIMY";"6";"";"107,88";"";"-44,17";"-44,17";"";"";"";"";"";"";"-";"";"-45,22";"";"";"18,49";"18,49";"18,49";"";"17,14";"";"17 544";"40,94";"";""
"NewEleven Gifts For Aunt - Aunt Birthday Gifts From Niece, Newphew, Kids - Auntie Gift Ideas, Christian Gift For Aunt, Auntie - Decorative Glass Scripture Jar With 92 Bible Verse COG: 1,97 / Price: 16,98";"B0FBRBL1CQ";"O8-51RP-7R9U";"6";"";"101,88";"";"";"";"";"";"";"";"";"";"-";"";"-40,26";"-11,82";"";"49,80";"49,80";"61,62";"";"48,88";"421,32";"17 544";"";"";""
"NEWELEVEN Valentines Gifts For Men - Aprons For Men With Pockets - Funny Gifts For Him - BBQ Kitchen Chef Apron COG: 3,54 / Price: 15,98";"B08ZYGT8SH";"QV-HPXT-L8DT";"5";"";"79,9";"";"-14,96";"-14,96";"";"";"";"";"";"";"100";"3,54";"-37,86";"-17,7";"";"12,92";"12,92";"27,08";"";"16,17";"72,99";"37 672";"18,72";"";""
"NewEleven 30th Birthday Gifts For Women - 30s Birthday Decorations - 30 Year Old Gifts For Her, Woman, Sister, Mom, Daughter, Best Friend - In My Thirties Era Glass - 16 Oz Coffee Glass COG: 2,1 / Price: 15,98";"B0CYPT8HM7";"C9-FSMU-8JV2";"5";"";"79,9";"";"-17,7";"-17,7";"";"";"";"";"";"";"-";"";"-37,62";"-10,5";"";"14,08";"14,08";"24,58";"";"17,62";"134,10";"11 488";"22,15";"";""
"NewEleven 40th Birthday Gifts For Women - 40s Birthday Decorations For Women - 40 Year Old Gifts For Her, Sister, Mom, Daughter, Best Friend - In My Forties Era Wine Tumbler - 12 Oz Tumbler COG: 3,21 / Price: 17,98";"B0CYS94K31";"75-LNB7-IBAL";"5";"";"89,9";"-0,9";"-33,49";"-33,49";"";"";"";"";"";"";"100";"3,21";"-35,4";"-16,05";"";"7,27";"7,27";"20,11";"";"8,09";"45,30";"11 758";"37,25";"";""
"NewEleven 40th Birthday Gifts For Men Women - 1985 40th Birthday Decorations For Him, Her - Turning 40-40 Year Old Gifts For Man, Woman, Mom, Dad, Wife, Husband - 20 Oz Tumbler COG: 3,29 / Price: 19,98";"B0DH86X93V";"Z0-L1YB-49DF";"5";"";"99,9";"";"-10,22";"-10,22";"";"";"";"";"";"";"-";"";"-37,22";"-16,45";"";"36,01";"36,01";"52,46";"";"36,05";"218,91";"3 679";"10,23";"";""
"NewEleven Class Of 2025 Graduation Gifts For Her, Friends - Funny Master Degree, College Graduation Gifts From Friends And Family - 16 Oz Coffee Glass COG: 2,3 / Price: 9,99";"B0DWMZXCZP";"UZ-8P0A-GPKD";"5";"";"49,95";"-3,1";"-15,16";"-15,16";"";"";"";"";"";"";"-";"";"-28,81";"-11,5";"";"-8,62";"-8,62";"2,88";"";"-17,26";"-74,96";"109 646";"30,35";"";""
"NewEleven Birthday Gifts For Mom, Funny Card Gifts For Mom, Awesome Mommy Present From Daughter, Best Mother's Day Gift Idea For Wife, Sister - Humorous Greeting Card COG: 0,45 / Price: 9,99";"B0F2T4JDF7";"AU-GMLU-KG6Z";"5";"";"49,95";"";"-10,49";"-10,49";"";"";"";"";"";"";"-";"";"-19,7";"-2,25";"";"17,51";"17,51";"19,76";"";"35,06";"778,22";"12 039";"21,00";"";""
"NewEleven Birthday Gifts For Women - Christian Gifts For Women, Her, Friends - Appreciation Present From Friend, Family - Decorative Glass Inspirational Scripture Jar With 92 Bible Verse COG: 2,62 / Price: 16,98";"B0F6M3X7LG";"9Y-C7LJ-8AVP";"5";"";"84,9";"";"-21,8";"-21,8";"";"";"";"";"";"";"-";"";"-33,55";"-13,1";"";"16,45";"16,45";"29,55";"";"19,38";"125,57";"17 544";"25,68";"";""
"NewEleven Retirement Gifts - Retirement Card For Women, Men, Boss - Coworker Leaving Gifts For Women, Happy Farewell Card, Meaningful Gift From Colleague - Greeting Card COG: 0,39 / Price: 7,99";"B0FC69GZW9";"W6-C0RK-V9ZB";"5";"";"39,95";"";"-37,04";"-37,04";"";"";"";"";"";"";"-";"";"-18,02";"-1,95";"";"-17,06";"-17,06";"-15,11";"";"-42,70";"-874,87";"8 153";"92,72";"";""
"NewEleven 40th Birthday Gifts For Women - 40th Birthday Decorations For Women, Her - Best 40 Year Old Gifts Ideas For Wife, Mom, Friends, Sister - Turning 40 Presents For Female - 12 Oz Tumbler COG: 3,87 / Price: 14,99";"B089QFK8NV";"6O-P3K0-CFHN";"4";"";"59,96";"";"";"";"";"";"";"";"";"";"-";"";"-26,58";"-15,48";"";"17,90";"17,90";"33,38";"";"29,85";"115,63";"11 758";"";"";""
"NewEleven Coworker Leaving Gifts - Gifts For Coworker Farewell, Going Away, Goodbye, New Job - Good Luck Presents For Friends, Boss, Women, Work Bestie – 16 Oz Coffee Glass COG: 2,42 / Price: 14,98";"B0BRB6NJCT";"MF-GYAU-GTQX";"4";"1";"59,92";"";"";"";"";"";"";"";"";"25,00";"-";"-13";"-28,06";"-9,68";"";"9,18";"9,18";"18,86";"";"15,32";"94,83";"35 368";"";"";""
"NewEleven Gifts For Nurse - Nurse Gift For Women - Caregiver Appreciation Gifts, Nursing Student, Nurses Practitioner - RN Gift For Nurses Women - 16 Oz Coffee Glass COG: 2,33 / Price: 9,99";"B0CBJR253J";"DM-ZO4D-MA58";"4";"";"39,96";"";"";"";"";"";"";"";"";"";"-";"";"-21,72";"-9,32";"";"8,92";"8,92";"18,24";"";"22,32";"95,71";"53 388";"";"";""
"NewEleven Gifts For Friends, Bestie – Work Bestie Presents For Women Friends - Appreciation Gifts For Coworkers, Unique Present Ideas For Coworker Leaving, Farewell Party – 16 Oz Coffee Glass COG: 2,55 / Price: 15,98";"B0CXXJ751C";"7X-5K3W-K6CS";"4";"";"63,92";"";"-9,89";"-9,89";"";"";"";"";"";"";"-";"";"-32";"-10,2";"";"11,83";"11,83";"22,03";"";"18,51";"115,98";"35 368";"15,47";"";""
"NewEleven Gifts for Women Friendship - Funny Gift for Friends Female - Unique Friendship Gifts for Women, Friend, Female, Bestie, BFF, Soul Sister, Work Bestie - Candle COG: 4,55 / Price: 17,98";"B0D9L8P1XL";"1G-WJN6-34JP";"4";"";"71,92";"-1,8";"";"";"";"";"";"";"";"";"-";"";"-31,71";"-18,2";"";"20,21";"20,21";"38,41";"";"28,10";"111,04";"300 926";"";"";""
"NewEleven 30th Birthday Gifts For Her Women - 1995 30th Birthday Decorations For Woman - 30 Year Old Gifts Idea For Friends, Sister - 16 Oz Coffee Glass COG: 2,11 / Price: 15,98";"B0DGGDN9WS";"SZ-GAM6-6BB0";"4";"";"63,92";"";"-23,21";"-23,21";"";"";"";"";"";"";"-";"";"-30,08";"-8,44";"";"2,19";"2,19";"10,63";"";"3,43";"25,95";"11 488";"36,31";"";""
"NewEleven 50th Birthday Gifts for Men Women - 1975 Birthday Decorations for Him, Her - Gifts for People Turning 50 Year Old Mom, Dad, Wife, Husband - Retro Trucker Hat COG: 1,99 / Price: 17,98";"B0DHC2C1S4";"S1-6FQM-HSP6";"4";"1";"71,92";"";"-14,1";"-14,1";"";"";"";"";"";"25,00";"-";"-13,74";"-34,3";"-7,96";"";"1,82";"1,82";"9,78";"";"2,53";"22,86";"145 948";"19,61";"";""
"NewEleven Gifts For Mom, Birthday Gifts For Mom From Daughters, Son - New Mom Gift, Mother In Law - Bible Jar For Mom - Decorative Glass Inspirational Scripture Jar with 92 Bible Verse COG: 1,99 / Price: 16,98";"B0DVSKXLS5";"UI-VXIT-1YW7";"4";"";"67,92";"";"-17,53";"-17,53";"";"";"";"";"";"";"-";"";"-27,86";"-7,96";"";"14,57";"14,57";"22,53";"";"21,45";"183,04";"17 544";"25,81";"";""
"NewEleven Nurse Gifts For Women, Nursing Student, Nurses Practitioner, Registered Nurses - Nurse Appreciation Gifts For Women From Friends, Family And Coworker - 20 Oz Tumbler COG: 3,5 / Price: 12,98";"B0DWN2GX75";"P3-U5Q5-Y2JP";"4";"1";"51,92";"";"";"";"";"";"";"";"";"25,00";"-";"-11,26";"-25,12";"-14";"";"1,54";"1,54";"15,54";"";"2,97";"11,00";"76 040";"";"";""
"NewEleven Daughter Birthday Gifts - Gifts For Daughter, Daughters In Law - Daughters Birthday Gift Ideas From Mom, Dad - Decorative Glass Scripture Jar With 92 Bible Verse COG: 2,44 / Price: 17,98";"B0F13VCCMP";"CG-9LUS-K14G";"4";"";"71,92";"-0,9";"";"";"";"";"";"";"";"";"-";"";"-28,35";"-9,76";"";"32,91";"32,91";"42,67";"";"45,76";"337,19";"17 542";"";"";""
"NewEleven Retirement Gift For Woman 2025 - Farewell Gifts For Coworkers, Boss, Friend, Teacher, Grandma - Coworker Leaving Gifts For Women From Friend, Family - Tumbler 12 Oz COG: 3,4 / Price: 22,98";"B0F189PXWB";"L4-F4C9-QOS5";"4";"";"91,92";"";"";"";"";"";"";"";"";"";"-";"";"-31,86";"-13,6";"";"46,46";"46,46";"60,06";"";"50,54";"341,62";"22 480";"";"";""
"NewEleven Funny Gifts For Boss - Thank You Card, Appreciation Present, Birthday Boss Gifts For Women, Men - Manager Gift From Staff, Coworker, Colleague - Greeting Card COG: 0,39 / Price: 5,99";"B0FC5XL613";"UU-WJ6M-WTFN";"4";"";"23,96";"";"";"";"";"";"";"";"";"";"-";"";"-13,12";"-1,56";"";"9,28";"9,28";"10,84";"";"38,73";"594,87";"8 153";"";"";""
"NewEleven Farewell Gifts For Coworkers - Coworker Leaving Gifts For Women, Goodbye Gift Card, Going Away Gift For Colleague, Work Bestie - Greeting Card COG: 0,39 / Price: 5,99";"B0FC68NMQ2";"UO-G2CF-RBYF";"4";"";"23,96";"-0,3";"";"";"";"";"";"";"";"";"-";"";"-13,08";"-1,56";"";"9,02";"9,02";"10,58";"";"37,65";"578,21";"8 153";"";"";""
"NewEleven Retirement Card For Woman, Men - Funny Retirement Present, Goodbye Gifts For Coworkers, Farewell Gifts For Men, Boss From Coworker - Greeting Card COG: 0,39 / Price: 5,99";"B0FC6B7XH2";"XL-UV7U-G4EA";"4";"";"23,96";"";"";"";"";"";"";"";"";"";"-";"";"-13,15";"-1,56";"";"9,25";"9,25";"10,81";"";"38,61";"592,95";"8 153";"";"";""
"NewEleven Wedding Gifts For Couples 2025 - Heartfelt Message, Meaningful Wedding Card For Bride, Groom - Newly Wed Gifts For The Couple From Friend, Family - Greeting Card COG: 0,39 / Price: 5,99";"B0FC6DL8X8";"XK-EXGK-T2H0";"4";"";"23,96";"";"";"";"";"";"";"";"";"";"-";"";"-13,13";"-1,56";"";"9,27";"9,27";"10,83";"";"38,69";"594,23";"20 331";"";"";""
"NewEleven 20 Oz Tumbler - Farewell Gift for Coworker, BPA-Free Stainless Steel Drinking Cup, Double Wall Vacuum Insulation, Going Away Gift for Men Women, Good Luck Gifts COG: 4,44 / Price: 19,98";"B09XDFF8FF";"HR-LSGT-JYQH";"3";"1";"59,94";"";"-7,64";"-7,64";"";"";"";"";"";"33,33";"-";"-17,34";"-23,55";"-13,32";"";"-1,91";"-1,91";"11,41";"";"-3,19";"-14,34";"52 989";"12,75";"";""
"NewEleven Coworker Leaving Gifts - Farewell Gifts, Going Away Gift For Coworker - New Job, Goodbye, Good Luck Gift For Coworkers, Colleagues, Boss, Men, Women, Friends - 20 Oz Tumbler COG: 4,22 / Price: 19,98";"B09ZYCD6GX";"1Q-FSNP-VBED";"3";"";"59,94";"";"";"";"";"";"";"";"";"";"-";"";"-22,33";"-12,66";"";"24,95";"24,95";"37,61";"";"41,62";"197,08";"34 361";"";"";""
"NewEleven Trucker Cap for Men, Dad, Husband, Fisherman – Funny Fishing Hat, Trucker Hat Birthday Present for Him, Father, Guys Who Love Fishing COG: 2,67 / Price: 17,98";"B0CY4G9VSR";"BP-B33W-HG8K";"3";"";"53,94";"";"";"";"";"";"";"";"";"";"-";"";"-25,71";"-8,01";"";"20,22";"20,22";"28,23";"";"37,49";"252,43";"337 132";"";"";""
"NewEleven Gifts For Book Lovers - Book Lovers Gifts For Women - Book Themed Gift for Readers, Librarians, Bookaholics - Birthday Gift For Women, Her, Best Friend – 16 Oz Coffee Glass COG: 2,32 / Price: 13,98";"B0CZDV6J3V";"0B-GUIB-F6GL";"3";"";"41,94";"";"-2,45";"-2,45";"";"";"";"";"";"";"-";"";"-21,9";"-6,96";"";"10,63";"10,63";"17,59";"";"25,35";"152,73";"75 395";"5,84";"";""
"NewEleven Gifts For New Mom 2025 – Pregnancy Gifts For First Time Mom, Pregnant Mommy, Expecting Mother, Moms To Be, Mommy To Be, New Moms - 16 Oz Coffee Glass COG: 2,23 / Price: 12,99";"B0DCJM56W3";"SG-SV6L-3ILW";"3";"";"38,97";"";"-2,08";"-2,08";"";"";"";"";"";"";"-";"";"-21,44";"-6,69";"";"8,76";"8,76";"15,45";"";"22,48";"130,94";"11 496";"5,34";"";""
"NewEleven Gift For Grandpa - Meaningful Grandpa Gifts From Granddaughter, Grandson - Grandpa Birthday Gifts For Grandfather, New Granddad, PaPa - Bible Jar COG: 2,62 / Price: 16,98";"B0F7WVKZ6F";"8O-S5PG-85KF";"3";"";"50,94";"";"";"";"";"";"";"";"";"";"-";"";"-20,13";"-7,86";"";"22,95";"22,95";"30,81";"";"45,05";"291,98";"17 544";"";"";""
"NewEleven Best Friend Birthday Gifts For Women - Best Friend Gift For Her, Him - Bestie Gift, Christian Present From Friends - Decorative Glass Inspirational Scripture Jar with 92 Bible Verse COG: 2,62 / Price: 17,98";"B0F8VPS7QN";"FY-G9UN-GE5E";"3";"";"53,94";"";"";"";"";"";"";"";"";"";"-";"";"-20,61";"-7,86";"";"25,47";"25,47";"33,33";"";"47,22";"324,05";"17 544";"";"";""
"NewEleven Dog Dad Gifts For Men - Humorous Present, Cute Birthday Gifts For Dog Lovers, Husband, Him - Funny Dog Dad Card From Friend, Family - Greeting Card COG: 0,39 / Price: 6,99";"B0FC5TBFWB";"60-KN47-M9LV";"3";"";"20,97";"-0,7";"-16,25";"-16,25";"";"";"";"";"";"";"-";"";"-10,12";"-1,17";"";"-7,27";"-7,27";"-6,1";"";"-34,67";"-621,37";"12 039";"77,49";"";""
"NewEleven Retirement Gift For Woman, Men - Heartfelt Message, Retirement Card For Boss, Friend - Coworker Leaving Gifts For Women From Friends, Colleague - Greeting Card COG: 0,39 / Price: 5,99";"B0FC69Q8BS";"ZB-KCAW-W2E3";"3";"";"17,97";"";"";"";"";"";"";"";"";"";"-";"";"-9,84";"-1,17";"";"6,96";"6,96";"8,13";"";"38,73";"594,87";"8 153";"";"";""
"NewEleven Wedding Gifts For Couples 2025 - Funny Wedding Card For Bride And Groom, Newly Wed Gifts For Couple - Meaningful Present From Friend And Family - Greeting Card COG: 0,39 / Price: 4,99";"B0FC6DQZCQ";"DP-MOZ6-JMS1";"3";"";"14,97";"";"";"";"";"";"";"";"";"";"-";"";"-11,43";"-1,17";"";"2,37";"2,37";"3,54";"";"15,83";"202,56";"20 331";"";"";""
