"Product";"ASIN";"SKU";"Units";"Refunds";"Sales";"Promo";"Ads";"Sponsored products (PPC)";"Sponsored Display";"Sponsored brands (HSA)";"Sponsored Brands Video";"Google ads";"Facebook ads";"% Refunds";"Sellable Quota";"Refund сost";"Amazon fees";"Cost of Goods";"Shipping";"Gross profit";"Net profit";"Estimated payout";"Expenses";"Margin";"ROI";"BSR";"Real ACOS";"Sessions";"Unit Session Percentage"
"NewEleven Gifts For Men, Dad, Husband, Friend - Birthday Gift For Women, Men - Thank You Gifts, Appreciation Gift, Graduation Presents For Men, Nurse, Teacher, Boss, Coworker – 20 Oz Tumbler COG: 3,66 / Price: 16,98";"B0CDLQFJK6";"EH-49BE-XWTF";"";"";"";"";"";"";"";"";"";"";"";"";"-";"";"9,88";"";"";"9,88";"9,88";"9,88";"";"";"";"7 641";"";"";""
"NewEleven Fathers Day Gift For Dad, Men - Funny Birthday Gifts For Father, Husband - Gifts For Father, New Dad, Bonus Papa, Husband, Uncle From Daughter, Son Mug with Lid - 14 Oz Tumbler COG: 4,17 / Price: 22,98";"B0CXXG46HR";"TF-FGX1-1AVQ";"";"";"";"";"";"";"";"";"";"";"";"";"-";"";"16,68";"";"";"16,68";"16,68";"16,68";"";"";"";"7 639";"";"";""
"NewEleven 30th Birthday Gifts For Women - 30s Birthday Decorations For Women - 30 Year Old Gifts For Her, Woman, Sister, Mom, Daughter, Best Friend - In My Thirties Era Wine Tumbler - 12 Oz Tumbler COG: 3,16 / Price: 17,98";"B0D79751XN";"ZC-P4K5-HI3B";"";"1";"";"";"";"";"";"";"";"";"";"∞";"-";"-15,73";"";"";"";"-15,73";"-15,73";"-15,73";"";"";"";"11 758";"";"";""
"NewEleven 25th Wedding 25th Anniversary Decorations, Wedding for Couple, Parents, Him, Her - Glass Christmas Ornament COG: 2,18 / Price: 5,99";"B0D7HNDG8Y";"RR-R416-X1G0";"";"";"";"";"";"";"";"";"";"";"";"";"-";"";"1,74";"-2,18";"";"-0,44";"-0,44";"1,74";"";"";"-20,18";"1 385 511";"";"";""
"NewEleven for Aunt from Niece, Nephew - Ornament for Aunt, New Auntie - Aunts Birthday Gift, Aunts Announcement, in My Auntie Era - Ceramic Christmas Ornaments COG: 1,19 / Price: 6,99";"B0DLV9CFVS";"F8-F46H-JKVQ";"";"";"";"";"-0,71";"-0,71";"";"";"";"";"";"";"-";"";"";"";"";"-0,71";"-0,71";"-0,71";"";"";"";"97 459";"";"";""
"NewEleven Retirement Ornament - Funny Retirement Gifts for Woman - Christmas Tree Decoration for Mom, Nurse, Teacher, Coworker & Friends COG: 2,17 / Price: 7,99";"B0DLVS7R7V";"O5-LD0Y-FJ4W";"";"";"";"";"";"";"";"";"";"";"";"";"-";"";"-25,62";"15,19";"";"-10,43";"-10,43";"-25,62";"";"";"68,66";"295 073";"";"";""
"NewEleven 1985 40th Birthday Gifts For Women - 40 Year Old Birthday Gifts Idea For Women, Her, Mom, Wife - Turning 40 Gift For Woman - 20 Oz Tumbler COG: 3,58 / Price: 21,98";"B0DM61B4F2";"1Y-PY2P-6Q4W";"";"";"";"";"-1,3";"-1,3";"";"";"";"";"";"";"-";"";"";"";"";"-1,30";"-1,30";"-1,3";"";"";"";"3 679";"";"";""
"NewEleven Fathers Day Gift For Dad, Birthday Gifts For Dad From Daughter, Son - New Dad Gift, Bible Jar For Father - Decorative Glass Inspirational Scripture Jar with 92 Bible Verse COG: 2,14 / Price: 16,98";"B0DVSKBSWN";"GE-UCH3-MNIE";"";"1";"";"";"";"";"";"";"";"";"";"∞";"";"-24,48";"16,23";"";"";"-8,25";"-8,25";"-8,25";"";"";"";"17 544";"";"";""
"NewEleven Gifts For Son - Meaningful Fathers Day Card For Son From Mom And Dad - Unique Present, Heartfelt Messeage, Father's Day Gifts For Sons, Dad First Time - Greeting Card COG: 0,44 / Price: 7,99";"B0F59X7WSH";"H2-9Z1Y-AGEF";"";"";"";"";"";"";"";"";"";"";"";"";"-";"";"8,83";"";"";"8,83";"8,83";"8,83";"";"";"";"12 039";"";"";""
"NewEleven Best Friends Gift - Heartfelt Message, Birthday Card For Friend - Best Friend Birthday Gifts For Women, Men, Meaningful Gift From Friends - Greeting Card COG: 0,39 / Price: 7,99";"B0FC6158DB";"6B-3XRW-U6OQ";"";"";"";"";"";"";"";"";"";"";"";"";"100";"0,39";"";"";"";"0,39";"0,39";"";"";"";"";"8 153";"";"";""
"NewEleven Cat Mom Gifts For Women - Cat Birthday Card, Funny Gift For Cat Lover, Cat Mom, Her - Cat Lover Gifts For Women From Friend, Family - Greeting Card COG: 0,39 / Price: 6,99";"B0FC6CY15S";"5P-CAQZ-6FK5";"";"";"";"";"-1,53";"-1,53";"";"";"";"";"";"";"-";"";"";"";"";"-1,53";"-1,53";"-1,53";"";"";"";"12 039";"";"";""
